/train/B03___19_Luke________TAMDIPN1DA_chunk4.wav,489196,அவர்கள் இவைகளைக் கேட்டுக் கொண்டிருக்கும் போது அவர் எருசலேமுக்கு அருகில் இருந்த படியினால் தேவனுடைய ராஜ்ஜியம் சீக்கிரமாக வெளிப்படும் என்று அவர்கள் நினைத்த படியினாலே அவர் ஒரு உவமையைச் சொன்னார் பிரபுவாகிய ஒருவன்
/train/B01___26_Matthew_____TAMDIPN1DA_chunk24.wav,570348,சபிக்கவும் சத்தியம் செய்யவும் தொடங்கினான் உடனே சேவல் கூவியது அப்பொழுது பேதுரு சேவல் கூவுகிற அதற்கு முன்னே நீ என்னை மூன்று முறை மறுதலிப்பாய் என்று இயேசு தன்னிடத்தில் சொன்ன வார்த்தையை நினைத்துக் கொண்டு வெளியே போய் மனம் கசந்த அழுதான்
/train/B04___19_John________TAMDIPN1DA_chunk6.wav,426188,இயேசு மறுமொழியாக பரத்திலிருந்து உமக்கு கொடுக்கப்படாமல் இருந்தால் என்மேல் உமக்கு ஒரு அதிகாரம் இருக்காது ஆகவே என்னை உம்மிடம் ஒப்புக் கொடுத்தவனுக்கு அதிக பாவம் உண்டு என்ற
/train/B02___05_Mark________TAMDIPN1DA_chunk2.wav,172140,பின்பு அவர்கள் கடலுக்கு அக்கறையில் உள்ள கதறினர் உடைய நாட்டிற்கு வந்தார்கள்
/train/B03___04_Luke________TAMDIPN1DA_chunk14.wav,317452,பின்பு அவர் ஜெப ஆலயத்தை விட்டு புறப்பட்டு சீமோன் வீட்டிற்கு போனார் அங்கு சீமானுடைய மாமியார் கடும் ஜுரம் படுத்திருந்த
/train/B23___01_1John_______TAMDIPN1DA_chunk16.wav,236300,அவர் ஒளியில் இருக்கிறது போல நாமும் ஒளியிலே நடந்தால் ஒருவரோடு ஒருவர் ஐக்கியம் உள்ளவர்களாக இருப்போம்
/train/B05___25_Acts________TAMDIPN1DA_chunk3.wav,414764,மூன்று நாட்கள் ஆன பின்பு சிசேரியன் இருந்து எருசலேமுக்கு போனான் அப்பொழுது பிரதான ஆசாரியனும் யூதர்களில் முதன்மையானவர்கள் அவனிடத்தில் வந்து பவுலுக்கு விரோதமாக முறையீடு செய்து
/train/B03___01_Luke________TAMDIPN1DA_chunk21.wav,521004,தூபம் காட்டுகிற நேரத்தில் மக்கள் எல்லோரும் கூட்டமாக வெளியிலே ஜெபம் பண்ணிக்கொண்டு இருந்தார்கள் அப்பொழுது கர்த்தருடைய தூதன் ஒருவன் தூப பீடத்தின் வலது பக்கத்தில் நின்று அவனுக்கு தரிசனம் ஆனான் சகரியா அவனைப் பார்த்து
/train/B03___05_Luke________TAMDIPN1DA_chunk2.wav,173676,பின்பு அவர் என்னை சேர்த்து கடலின் அருகே நின்றபோது மக்கள் கூட்ட
/train/B04___07_John________TAMDIPN1DA_chunk10.wav,410572,பின்பு அந்தக் காவலர்கள் பிரதான ஆசாரியர்கள் இடத்திற்கும் பரிசேயர்கள் இடத்திற்கும் திரும்பி வந்தார்கள் இவர்கள் அவர்களைப் பார்த்து நீங்கள் அவனை ஏன் அழைத்து வரவில்லை என்று கேட்டார்கள்
/train/B03___01_Luke________TAMDIPN1DA_chunk5.wav,361548,ஆரம்ப முதல் கண்கூடாக பார்த்து வசனத்தை போதித்தவர்கள் எங்களுக்கு ஒப்புவித்த படியே அவைகளை குறித்து சரித்திரம் எழுத அநேகம் பேர் முயற்சித்தன
/train/B04___18_John________TAMDIPN1DA_chunk9.wav,377740,குளிர்காலமாக இருந்ததினால் அதிகாரிகளும் தகவல்களும் நின்று குளிர் காய்ந்து கொண்டிருந்தார்கள் அவர்களோடு பேதுருவும் நின்று குளிர் காய்ந்து கொண்டிருந்த
/train/B03___07_Luke________TAMDIPN1DA_chunk2.wav,486796,இயேசு தம்முடைய வார்த்தைகளை எல்லாம் மக்கள் கேட்கும்படி சொல்லி முடித்த பின்பு கப்பர் நகும போனார் அங்கே 100 பேர் கொண்ட படைப்பிரிவின் அதிபதி ஒருவனுக்கு பிரியமான வேலைக்காரன் வியாதியால் மரண வேதனைப்பட்டான்
/train/B07___13_1CorinthiansTAMDIPN1DA_chunk6.wav,435724,இப்பொழுது நான் குறைந்த அறிவுள்ளவன் அப்பொழுது நான் அறியப்பட்டு இருக்கிற படியே அறிந்து கொள்ளுவேன் இப்பொழுது விசுவாசம் நம்பிக்கை அன்பு இம்மூன்றும் நிலைத்திருக்கிறது இவைகளில் அன்பே பெரியது
/train/B01___02_Matthew_____TAMDIPN1DA_chunk2.wav,533836,ஏரோது ராஜாவின் நாட்களில் யூதேயாவிலுள்ள பெத்லகேமில் இயேசு பிறந்த பொழுது கிழக்கிலிருந்து சாஸ்திரிகள் எருசலேமுக்கு வந்து யூதர்களுக்கு ராஜாவாக பிறந்து இருக்கிறவர் எங்கே கிழக்கிலே அவருடைய நட்சத்திரத்தைக் கண்டு அவரை தொழுது கொள்ள வந்தோம் என்றார்கள்
/train/B05___21_Acts________TAMDIPN1DA_chunk17.wav,365164,அவர்களிடத்தில் விடைபெற்றுக் கொண்ட பின்பு நாங்கள் கப்பல் ஏறினோம் அவர்கள் தங்களுடைய வீடுகளுக்கு திரும்பிப் போனார்கள் நாங்கள் கப்பல் பயணத்தை முடித்து தீர்வு பட்டணத்தை விட்டு
/train/B04___17_John________TAMDIPN1DA_chunk3.wav,535820,பிதாவே வேலை வந்தது நீர் உம்முடைய குமாரிடம் ஒப்படைக்கப்பட்ட அனைவருக்கும் அவர் நித்திய ஜீவனைக் கொடுக்கும்படி மாம்சமான யாவர் மேலும் நீர் அவருக்கு அதிகாரம் கொடுத்தபடியே உம்முடைய குமாரன் உம்மை மகிமைப் படுத்தும் படி
/train/B01___24_Matthew_____TAMDIPN1DA_chunk10.wav,394924,இவைகளை எல்லாம் நீங்கள் பார்க்கும் பொழுது அவர் நெருக்கமாக வாசலின் அருகே வந்திருக்கிறார் என்று தெரிந்து கொள்ளுங்கள் இவைகள் எல்லாம் சம்பவிக்கும் முன்னே இந்த சந்ததி ஒளிந்து போகா
/train/B01___07_Matthew_____TAMDIPN1DA_chunk11.wav,243212,ஜீவனுக்குப் போகிற வாசல் உருகின வழி நெருக்கமாக இருக்கிறது அதை கண்டுபிடிப்பவர்கள் சில
/train/B06___01_Romans______TAMDIPN1DA_chunk16.wav,539628,நீங்கள் உறுதிப்படுத்த படுவதற்காக ஆவிக்குரிய சில வரங்களை உங்களுக்கு கொடுப்பதற்காகவும் உங்களுக்குள்ளும் எனக்குள்ளும் உள்ள விசுவாசத்தினால் உங்களோடு நானும் ஆறுதல் அடைவதற்கும் உங்களை பார்க்க ஆவலாக இருக்கிறதாலே
/train/B04___08_John________TAMDIPN1DA_chunk2.wav,299628,மறுநாள் காலையில் அவர் திரும்பி தேவாலயத்திற்கு வந்தபோது மக்கள் எல்லோரும் அவரிடத்தில் வந்தார்கள் அவர் உட்கார்ந்து அவர்களுக்கு உபதேசம் செய்தார்
/train/B02___10_Mark________TAMDIPN1DA_chunk3.wav,489068,வேறொரு பெண்ணை திருமணம் செய்தால் அவன் அவளுக்கு விரோதமாக விபச்சாரம் செய்கிறவன் ஆக இருப்பான் மனைவியும் தன் கணவனை விவாகரத்து செய்துவிட்டு வேறு ஒருவனை திருமணம் செய்தால் விபச்சாரம் செய்கிறார்கள் என்ற
/train/B06___01_Romans______TAMDIPN1DA_chunk34.wav,207180,தேவனை தெரிந்துகொள்ளும் அறிவைப் பற்றிக் கொண்டிருக்க அவர்களுக்கு மனமில்லாமல் இருந்தத
/train/B02___14_Mark________TAMDIPN1DA_chunk2.wav,197036,இரண்டு நாட்களுக்குப் பின்பு புளிப்பில்லாத அப்பம் சாப்பிடுகிற பஸ்கா பண்டிகை வந்தது
/train/B03___11_Luke________TAMDIPN1DA_chunk7.wav,163372,பின்பு இயேசு ஊமையாக இருந்தவன் இடத்தில் இருந்த ஒரு பிசாசை துரத்தின
/train/B05___22_Acts________TAMDIPN1DA_chunk6.wav,242828,அதற்கு அவர் நீ போ நான் உன்னை தொலைவில் உள்ள யூதர் அல்லாதவர் இடத்தில் அனுப்புவேன் என்று சொன்னார் என்ற
/train/B05___22_Acts________TAMDIPN1DA_chunk11.wav,441644,நிச்சயமாக அறிய விரும்பி அவன் அடுத்த நாளிலே அவனை விடுவித்து பிரதான ஆசாரியர்களும் ஆலோசனை சங்கத்தினர் அனைவரையும் கூடி வரும்படி ஆணையிட்டு அவனை அழைத்துக்கொண்டு போய் அவர்களுக்கு முன்பாக நிறுத்தினான்
/train/B03___15_Luke________TAMDIPN1DA_chunk11.wav,523308,காணாமல் போன வெள்ளிக் காசை கண்டுபிடித்தேன் என்னோடு கூட மகிழ்ச்சியாக இருங்கள் என்பதால் அல்லவா அதுபோல மனம் திரும்புகிற ஒரே பாதையின் நிமித்தம் தேவனுடைய தூதர்களுக்கு முன்பாக மகிழ்ச்சி உண்டாயிருக்கிறது என்று உங்களுக்குச் சொல்லுகிறேன் என்றார்
/train/B05___13_Acts________TAMDIPN1DA_chunk2.wav,178508,அந்தியோகியா பட்டணத்தில் உள்ள சபையிலே வர்ண பாபும் நீகர் எனப்பட்ட சிபியோ
/train/B01___27_Matthew_____TAMDIPN1DA_chunk9.wav,299628,அப்பொழுது அவன் பரப ஆசைகளுக்கு விடுதலையாக்கி இயேசுவையும் சாட்டையால் அடித்து சிலுவையில் வரைவதற்கு ஒப்புக் கொடு
/train/B03___24_Luke________TAMDIPN1DA_chunk12.wav,231980,பின்பு அவர் பெத்தானியா வரைக்கும் அவர்களை அழைத்துக் கொண்டு போய் தம்முடைய கரங்களை உயர்த்தி அவர்களை ஆசிர்வதித்த
/train/B04___21_John________TAMDIPN1DA_chunk16.wav,367244,இயேசு செய்த வேறு அநேக காரியங்களும் உண்டு அவைகளை ஒவ்வொன்றாக எழுதினால் எழுதப்படும் புத்தகங்கள் உலகம் கொள்ளாது என்று நினைக்கிறேன் ஆமென்
/train/B05___28_Acts________TAMDIPN1DA_chunk5.wav,175052,உப்பிலிய என்னும் பெயர் கொண்ட அவனுடைய நிலங்கள் அந்த இடத்திற்கு அருகில் இருந்தது
/train/B04___17_John________TAMDIPN1DA_chunk4.wav,331852,நீர் உன்னுடைய குமாரனை மகிமைப்படுத்தும் ஒன்றான உண்மை தேவனாகிய உண்மையும் நீர் அனுப்பியவர் ஆகிய இயேசு கிறிஸ்துவையும் அறிவதே நித்திய ஜீ
/train/B04___18_John________TAMDIPN1DA_chunk4.wav,311372,அப்பொழுது இயேசு பேதுருவை பார்த்து உன் வாளை உரையிலே போடு பிதா எனக்கு கொடுத்த பாத்திரத்தில் நான் குடிக்காது இருப்பேனோ என்ற
/train/B03___05_Luke________TAMDIPN1DA_chunk6.wav,357484,கூட்டாளிகள் வந்து தங்களுக்கு உதவி செய்ய வேண்டும் என்று அவர்களுக்கு சைகை காட்டினார்கள் அவர்கள் வந்து இரண்டு படகுகளும் அமிழ்து போகும் அளவிற்கு நிரப்பினார்கள்
/train/B05___14_Acts________TAMDIPN1DA_chunk13.wav,198796,கடந்த காலங்களில் அவர் எல்லா மக்களையும் தங்கள் தங்கள் வழிகளிலே நடக்க வைத்திருந்த
/train/B03___06_Luke________TAMDIPN1DA_chunk39.wav,602092,நெருஞ்சி செடியில் திராட்சை பழங்களை பறிக்கிறது இல்லை நல்ல மனிதன் தன் இருதயமாக நல்ல பொக்கிஷத்திலிருந்து நல்லதை எடுத்துக் காட்டுகிறான் பொல்லாத மனிதன் தன் இருதயம் ஆகிய பொல்லாத பொக்கிஷத்தில் இருந்து பொல்லாதது எடுத்துக் காட்டுகிறான் இருதயத்தின் நிறைவினால் அவனவனுடைய வாய் பேசும்
/train/B03___17_Luke________TAMDIPN1DA_chunk12.wav,456748,நோவாவின் நாட்களில் நடந்தது போல மனித குமாரனுடைய நாட்களிலும் நடக்கும் நோவா பேழைக்குள் பிரவேசித்த நாள் வரை மக்கள் புசித்துக் குடித்தார்கள் பெண் எடுத்தும் பெண் கொடுத்தும் இருந்தார்கள் பெருவெள்ளம் வந்து
/train/B06___01_Romans______TAMDIPN1DA_chunk14.wav,380652,உங்களுடைய விசுவாசம் உலகமெங்கும் பிரசித்தமான படியினாலே முதலாவது நான் உங்கள் எல்லோருக்காகவும் இயேசு கிறிஸ்து மூலமாக என் தேவனுக்கு நன்றி செலுத்துகிறேன்
/train/B02___09_Mark________TAMDIPN1DA_chunk1.wav,391372,இயேசு அவர்களைப் பார்த்து இங்கே நிற்கிறேன் சிலர் தேவனுடைய ராஜ்ஜியம் பலத்தோடு வருவதை பார்ப்பதற்கு முன்பு மரிப்பதில்லை என்று உண்மையாகவே உங்களுக்குச் சொல்லுகிறேன் என்றார்
/train/B03___12_Luke________TAMDIPN1DA_chunk15.wav,284812,பின்பு அவர் மக்களை நோக்கி மேற்கே மேகம் எழும்புகிறது நீங்கள் காணும்போது மழை வரும் என்று சொல்லுகிறீர்கள் அப்படியே நடக்கும்
/train/B03___17_Luke________TAMDIPN1DA_chunk11.wav,250604,அதற்கு முன்பு அவர் அனேகம் பாடுகள் பட்டு இந்த சந்ததியினர் ஆகாதவன் என்று தள்ளப்பட வேண்டியதாக இருக்கிறது
/train/B02___12_Mark________TAMDIPN1DA_chunk17.wav,586828,இயேசு காணிக்கை பெட்டுக்கு எதிராக உட்கார்ந்து மக்கள் காணிக்கை பெட்டியில் பணம் போடுகிறது பார்த்துக் கொண்டிருந்தார் செல்வந்தர்கள் அநேகர் அதிகமாக போட்டார்கள் ஏழையான ஒரு விதவையும் வந்து ஒரு நாணய மதிப்பிற்கு சரியான இரண்டு காசுகளை போட்ட
/train/B03___07_Luke________TAMDIPN1DA_chunk10.wav,420428,வேறொருவர் வர நாங்கள் காத்திருக்க வேண்டுமா என்று கேளுங்கள் என்று சொல்லி அனுப்பினான் அப்படியே அவர்கள் இயேசுவிடம் வந்து வருகிறவர் நீர் தானா அல்லது வேறு ஒருவர் வர நாங்கள் காத்திருக்க வேண்டுமா
/train/B03___06_Luke________TAMDIPN1DA_chunk30.wav,563756,அதிகமாக இருக்கும் உன்னதமான தேவனுக்கு நீங்கள் பிள்ளைகளாக இருப்பீர்கள் அவர் நன்றி அறியாதவர்களுக்கும் துரோகிகளுக்கும் நன்மை செய்கிறாரே எனவே உங்களுடைய பிதா இரக்கம் உள்ளவராக இருப்பது போல நீங்களும் இரக்கம் உள்ளவர்களாக இருங்கள்
/train/B03___01_Luke________TAMDIPN1DA_chunk9.wav,271308,நீ அறிய வேண்டும் என்று அவைகளை சரியாக ஒழுங்குபடுத்தி உமக்கு எழுதுவது எனக்கு நல்லதாக தோன்றிய
/train/B01___07_Matthew_____TAMDIPN1DA_chunk2.wav,193932,நீங்கள் குற்றவாளிகள் என்று தீர்க்கப்படாத படிக்கு மற்றவர்களை குற்றவாளிகள் என்று தீர்க்காமல் இருங்கள்
/train/B02___13_Mark________TAMDIPN1DA_chunk2.wav,439980,இயேசு தேவாலயத்தை விட்டு புறப்படும் போது அவருடைய சீடர்களில் ஒருவன் அவரைப் பார்த்து போதகரே இதோ இந்த கற்கள் எப்படிப்பட்டது இந்த கட்டிடங்கள் எப்படிப்பட்டது பாரும் என்ற
/train/B03___05_Luke________TAMDIPN1DA_chunk23.wav,207180,ஒருவனும் புதிய ஆடையின் துண்டை பழைய ஆடையோடு வைத்து இணைக்க மாட்டான் இணைத்தால்
/train/B01___24_Matthew_____TAMDIPN1DA_chunk11.wav,221772,என்று உண்மையாகவே உங்களுக்குச் சொல்லுகிறேன் வானமும் பூமியும் ஒழிந்துபோம் என் வார்த்தைகளோ ஒளிந்து போவதில்லை
/train/B03___06_Luke________TAMDIPN1DA_chunk26.wav,182540,என் வார்த்தைகளைக் கேட்கிற உங்களுக்கு நான் சொல்லுகிறேன் உங்களுடைய பகைவர்களை நேசியுங்கள்
/train/B03___06_Luke________TAMDIPN1DA_chunk15.wav,445100,மத்தேயு தோமா அல்பேயுவின் குமாரனாகிய யாக்கோபு செல்வோம் எனப்பட்ட சீமோன் யாக்கோபின் சகோதரனாகிய யூதா துரோகியான யூதாஸ் காரியோத் என்பவர்களே
/train/B04___21_John________TAMDIPN1DA_chunk10.wav,443916,என்னை நேசிக்கிறாயா என்று அவர் மூன்றாவது முறை தன்னை கேட்டதினால் பேதுரு துக்கப்பட்டு ஆண்டவரே இது எல்லாவற்றையும் அறிந்திருக்கிறேன் நான் உம்மை நேசிக்கிறேன் என்பதையும் நீர் அறிவீர் என்றான்
/train/B02___04_Mark________TAMDIPN1DA_chunk7.wav,409740,இன்னும் அவர் அவர்களைப் பார்த்து நீங்கள் கேட்கிறதே கவனியுங்கள் எந்த அளவினால் அளக்கிறீர்களோ அந்த அளவினால் உங்களுக்கும் அளக்கப்படும் கேட்கிற உங்களுக்கு அதிகம் கொடுக்கப்படும்
